{
  "decisions_used": {
    "drums": {
      "choice": "A",
      "edits": []
    },
    "bass": {
      "choice": "A",
      "edits": []
    },
    "pad": {
      "enabled": true,
      "level_db": -20.0
    },
    "original_drums_db": -1.5,
    "original_bass_db": -3.0,
    "intro_bars": 2,
    "breakdown": true,
    "bridge": {
      "choice": "none"
    },
    "vocal": {
      "lead_takes": []
    },
    "_source": "defaults (no human_decisions.json yet)"
  },
  "variant_descriptions": {
    "drums": "Straight pop/rock groove: kick on 1 & 3, snare on 2 & 4, 8th-note hats, snare-roll fill at section ends.",
    "bass": "Long root notes (whole/half), octave drop every 4th bar — warm, leaves room for the vocal."
  },
  "tempo_bpm": 132.51,
  "key": "D major",
  "bar_len_s": 1.8112,
  "bars_total": 60,
  "intro": {
    "bars": 2,
    "len_s": 3.622,
    "chord": "D",
    "output_range": [
      0.0,
      3.622
    ],
    "content": "pad + riser + hat pick-up (new)"
  },
  "original_offset_in_output_s": 3.622,
  "tail_trimmed_s": 0.0,
  "changed_sections": [
    {
      "section_index": 2,
      "label": "hook",
      "bars": 9,
      "orig_range": [
        40.472,
        56.61
      ],
      "output_range": [
        44.094,
        60.232
      ]
    },
    {
      "section_index": 3,
      "label": "verse",
      "bars": 18,
      "orig_range": [
        56.61,
        89.223
      ],
      "output_range": [
        60.232,
        92.845
      ]
    }
  ],
  "breakdown": {
    "orig_start": 54.799,
    "orig_end": 56.61,
    "output_range": [
      58.421,
      60.232
    ]
  },
  "events": [
    {
      "type": "stem_duck",
      "orig_start": 40.472,
      "orig_end": 56.61,
      "drums_db": -1.5,
      "bass_db": -3.0,
      "ramp_ms": 180
    },
    {
      "type": "stem_duck",
      "orig_start": 56.61,
      "orig_end": 89.223,
      "drums_db": -1.5,
      "bass_db": -3.0,
      "ramp_ms": 180
    },
    {
      "type": "breakdown",
      "orig_start": 54.799,
      "orig_end": 56.61,
      "drums_db": -14,
      "bass_db": -8
    }
  ],
  "new_midi_counts": {
    "drum_events": 332,
    "bass_notes": 33,
    "pad_chords": 27
  },
  "levels": {
    "drums_gain_db": -9.67,
    "bass_gain_db": -14.35,
    "pad_gain_db": -8.53,
    "target_drums_rms_db": -22.98,
    "target_bass_rms_db": -22.91,
    "section_mix_rms_db": -14.91
  },
  "sections_output_time": [
    {
      "index": 0,
      "start": 4.644,
      "end": 22.5,
      "bars": 10,
      "rms_db": -16.41,
      "energy_rank": 6,
      "label": "intro"
    },
    {
      "index": 1,
      "start": 22.5,
      "end": 44.094,
      "bars": 12,
      "rms_db": -13.89,
      "energy_rank": 1,
      "label": "hook"
    },
    {
      "index": 2,
      "start": 44.094,
      "end": 60.232,
      "bars": 9,
      "rms_db": -14.78,
      "energy_rank": 2,
      "label": "hook"
    },
    {
      "index": 3,
      "start": 60.232,
      "end": 92.845,
      "bars": 18,
      "rms_db": -16.18,
      "energy_rank": 5,
      "label": "verse"
    },
    {
      "index": 4,
      "start": 92.845,
      "end": 100.194,
      "bars": 4,
      "rms_db": -16.1,
      "energy_rank": 3,
      "label": "verse"
    },
    {
      "index": 5,
      "start": 100.194,
      "end": 111.372,
      "bars": 7,
      "rms_db": -16.1,
      "energy_rank": 4,
      "label": "outro"
    }
  ],
  "duration_out_s": 111.372,
  "duration_in_s": 107.75,
  "human_still_needed": [
    "Choose drums/bass variant (A/B/C) and edit notes -> human_decisions.json, re-run: python scripts/pipeline.py <track> --from arrange",
    "Hum/sing a new melody for the bridge or hook -> 03_human_raw/, convert with scripts/hum_to_midi.py",
    "Record lead/harmony vocal takes -> 03_human_raw/TAKE_xx.wav, then scripts/vocal_prep.py",
    "Full listening pass of LISTEN_arranged.mp3 and the A/B file"
  ]
}